{
  "title": "Menemen (Turkish Scrambled Eggs with Tomatoes)",
  "sourceUrl": "https://www.theguardian.com/food/2026/aug/29/yotam-ottolenghi-simple-breakfasts-recipes",
  "sourceName": "The Guardian",
  "tags": ["breakfast", "turkish", "vegetarian", "eggs", "quick"],
  "servings": {
    "base": 2,
    "unit": "people"
  },
  "timing": {
    "prepMinutes": 5,
    "cookMinutes": 15,
    "totalMinutes": 20
  },
  "ingredients": [
    {
      "id": "ing_1",
      "name": "olive oil",
      "amount": 2,
      "unit": "tbsp",
      "notes": null
    },
    {
      "id": "ing_2",
      "name": "onion",
      "amount": 1,
      "unit": "piece",
      "notes": "finely chopped"
    },
    {
      "id": "ing_3",
      "name": "green bell pepper",
      "amount": 1,
      "unit": "piece",
      "notes": "finely chopped"
    },
    {
      "id": "ing_4",
      "name": "garlic",
      "amount": 3,
      "unit": "piece",
      "notes": "cloves, minced"
    },
    {
      "id": "ing_5",
      "name": "tomato paste",
      "amount": 1,
      "unit": "tbsp",
      "notes": null
    },
    {
      "id": "ing_6",
      "name": "ground cumin",
      "amount": 1,
      "unit": "tsp",
      "notes": null
    },
    {
      "id": "ing_7",
      "name": "Aleppo chilli flakes",
      "amount": 1,
      "unit": "tsp",
      "notes": "or regular chilli flakes"
    },
    {
      "id": "ing_8",
      "name": "ground cinnamon",
      "amount": 0.25,
      "unit": "tsp",
      "notes": null
    },
    {
      "id": "ing_9",
      "name": "cherry tomatoes",
      "amount": 300,
      "unit": "g",
      "notes": "halved"
    },
    {
      "id": "ing_10",
      "name": "eggs",
      "amount": 4,
      "unit": "piece",
      "notes": null
    },
    {
      "id": "ing_11",
      "name": "flat-leaf parsley",
      "amount": 2,
      "unit": "tbsp",
      "notes": "chopped"
    },
    {
      "id": "ing_12",
      "name": "salt",
      "amount": 0.5,
      "unit": "tsp",
      "notes": "or to taste"
    },
    {
      "id": "ing_13",
      "name": "black pepper",
      "amount": 0.25,
      "unit": "tsp",
      "notes": "freshly ground"
    }
  ],
  "steps": [
    {
      "id": "step_1",
      "order": 1,
      "title": "Soften vegetables",
      "text": "Heat the olive oil in a large non-stick pan over medium heat. Add the [onion] and [green bell pepper] and cook, stirring occasionally, for about 5 minutes until softened.",
      "timer": { "durationSeconds": 300, "label": "Soften vegetables" },
      "ingredientRefs": ["ing_2", "ing_3"]
    },
    {
      "id": "step_2",
      "order": 2,
      "title": "Bloom spices",
      "text": "Add the [garlic], [tomato paste], [ground cumin], [Aleppo chilli flakes], and [ground cinnamon]. Cook, stirring constantly, for 1 minute until fragrant.",
      "timer": { "durationSeconds": 60, "label": "Bloom spices" },
      "ingredientRefs": ["ing_4", "ing_5", "ing_6", "ing_7", "ing_8"]
    },
    {
      "id": "step_3",
      "order": 3,
      "title": "Cook tomatoes",
      "text": "Add the [cherry tomatoes] and a pinch of [salt]. Cook, stirring occasionally, for about 8 minutes until the tomatoes break down and release their juices.",
      "timer": { "durationSeconds": 480, "label": "Cook tomatoes" },
      "ingredientRefs": ["ing_9", "ing_12"]
    },
    {
      "id": "step_4",
      "order": 4,
      "title": "Cook eggs",
      "text": "Make 4 wells in the tomato mixture and crack an [egg] into each. Season with [salt] and [black pepper]. Cover and cook for 3-5 minutes until the whites are set but yolks are still runny.",
      "timer": { "durationSeconds": 240, "label": "Cook eggs" },
      "ingredientRefs": ["ing_10", "ing_12", "ing_13"]
    },
    {
      "id": "step_5",
      "order": 5,
      "title": "Garnish and serve",
      "text": "Remove from heat. Scatter [parsley] over the top. Serve immediately with crusty bread for dipping.",
      "timer": null,
      "ingredientRefs": ["ing_11"]
    }
  ],
  "createdAt": "2026-08-30T12:00:00Z",
  "updatedAt": "2026-08-30T12:00:00Z"
}
